[
    {
        "ruleId": "color-contrast",
        "wcagCriteria": "1.4.3",
        "wcagLevel": "AA",
        "wcagTitle": "Contrast (Minimum)",
        "wcagVersion": "2.0",
        "en301549Criteria": "9.1.4.3",
        "en301549Title": "Contrast (minimum)",
        "en301549Chapter": 9,
        "dosLagenApplies": true,
        "dosLagenReference": "Lag 2018:1937 §7, WCAG 2.1 nivå AA krävs",
        "remediation": {
            "description": "Text och bilder av text måste ha ett kontrastvärde på minst 4,5:1 (3:1 för stor text).",
            "technicalGuidance": "Använd verktyg som WebAIM Contrast Checker för att verifiera kontrast. Justera färgval eller lägg till bakgrundsopacity för att uppnå korrekt kontrast.",
            "component": "@holmdigital/components/Button",
            "codeExample": "import { Button } from '@holmdigital/components';\n\n// Bad: Poor contrast\n<button style={{ background: '#777', color: '#999' }}>Click me</button>\n\n// Good: Use accessible component\n<Button variant=\"primary\">Click me</Button>",
            "wcagTechnique": [
                "G18",
                "G145",
                "G174"
            ]
        },
        "holmdigitalInsight": {
            "diggRisk": "high",
            "eaaImpact": "critical",
            "swedishInterpretation": "En av de vanligaste orsakerna till anmärkningar från tillsynsmyndigheter (DIGG). Särskilt viktigt för offentlig sektor.",
            "commonMistakes": [
                "Grå text på vit bakgrund (#777 på #FFF)",
                "Ljusblå länkar utan understrykning",
                "Placeholder-text med för låg kontrast"
            ],
            "diggPrecedent": "Regulators often cite poor contrast in primary navigation elements.",
            "priorityRationale": "Critical for users with low vision. Affects readability for all users in varying lighting conditions."
        },
        "testability": {
            "automated": true,
            "requiresManualCheck": false,
            "pseudoAutomation": false,
            "complexity": "simple"
        },
        "tags": [
            "color",
            "contrast",
            "visual",
            "wcag2a",
            "wcag21aa"
        ]
    },
    {
        "ruleId": "keyboard-accessible",
        "wcagCriteria": "2.1.1",
        "wcagLevel": "A",
        "wcagTitle": "Keyboard",
        "wcagVersion": "2.0",
        "en301549Criteria": "9.2.1.1",
        "en301549Title": "Keyboard",
        "en301549Chapter": 9,
        "dosLagenApplies": true,
        "dosLagenReference": "Lag 2018:1937 §7, WCAG 2.1 nivå A krävs",
        "remediation": {
            "description": "All funktionalitet måste vara navigerbar med tangentbord.",
            "technicalGuidance": "Använd semantiska HTML-element (button, a, input) istället för div/span med click handlers. Se till att tabindex används korrekt.",
            "component": "@holmdigital/components/Button",
            "codeExample": "// Bad: Div with onClick\n<div onClick={handleClick}>Click Me</div>\n\n// Good: Button element\n<button onClick={handleClick}>Click Me</button>\n\n// Best: Use HolmDigital component\nimport { Button } from '@holmdigital/components';\n<Button onClick={handleClick}>Click Me</Button>",
            "wcagTechnique": [
                "G202",
                "H91"
            ]
        },
        "holmdigitalInsight": {
            "diggRisk": "critical",
            "eaaImpact": "critical",
            "swedishInterpretation": "Tangentbordsstyrning är grundläggande och icke-förhandlingsbart. Högsta prioritet vid granskning.",
            "commonMistakes": [
                "Använder div/span för klickbara element",
                "Egna dropdown-menyer utan tangentbordsstöd",
                "Modala dialoger som inte fångar fokus korrekt"
            ],
            "diggPrecedent": "Auditors have issued fines for sites where core functions (e.g. forms, navigation) are not keyboard accessible.",
            "priorityRationale": "Critical for users with motor disabilities and screen reader users."
        },
        "testability": {
            "automated": false,
            "requiresManualCheck": true,
            "pseudoAutomation": true,
            "complexity": "moderate"
        },
        "tags": [
            "keyboard",
            "interaction",
            "wcag2a",
            "wcag21a"
        ]
    },
    {
        "ruleId": "alt-text",
        "wcagCriteria": "1.1.1",
        "wcagLevel": "A",
        "wcagTitle": "Non-text Content",
        "wcagVersion": "2.0",
        "en301549Criteria": "9.1.1.1",
        "en301549Title": "Non-text content",
        "en301549Chapter": 9,
        "dosLagenApplies": true,
        "dosLagenReference": "Lag 2018:1937 §7, WCAG 2.1 nivå A krävs",
        "remediation": {
            "description": "Alla bilder måste ha beskrivande alternativtext.",
            "technicalGuidance": "Lägg till alt-attribut på alla img-element. För dekorativa bilder, använd alt=\"\". För informativa bilder, beskriv innehållet koncist.",
            "codeExample": "// Bad: Msising alt\n<img src=\"logo.png\" />\n\n// Good: Descriptive alt\n<img src=\"logo.png\" alt=\"HolmDigital Logo\" />\n\n// Good: Decorative image\n<img src=\"decoration.png\" alt=\"\" role=\"presentation\" />",
            "wcagTechnique": [
                "G94",
                "G95",
                "H37"
            ]
        },
        "holmdigitalInsight": {
            "diggRisk": "high",
            "eaaImpact": "high",
            "swedishInterpretation": "Särskilt viktigt för logotyper och informativ grafik. Kontrolleras ofta i granskningar.",
            "commonMistakes": [
                "Saknar alt-text helt",
                "Alt-text som bara säger 'bild' eller 'ikon'",
                "Filnamn som alt-text (t.ex. 'IMG_1234.jpg')",
                "Dekorativa bilder med onödig beskrivning"
            ],
            "diggPrecedent": "Audits frequently cite missing alt text, especially for vital infographics.",
            "priorityRationale": "Critical for screen reader users to access visual information."
        },
        "testability": {
            "automated": true,
            "requiresManualCheck": true,
            "pseudoAutomation": false,
            "complexity": "simple"
        },
        "tags": [
            "images",
            "alt-text",
            "wcag2a",
            "wcag21a"
        ]
    },
    {
        "ruleId": "form-labels",
        "wcagCriteria": "3.3.2",
        "wcagLevel": "A",
        "wcagTitle": "Labels or Instructions",
        "wcagVersion": "2.0",
        "en301549Criteria": "9.3.3.2",
        "en301549Title": "Labels or instructions",
        "en301549Chapter": 9,
        "dosLagenApplies": true,
        "dosLagenReference": "Lag 2018:1937 §7, WCAG 2.1 nivå A krävs",
        "remediation": {
            "description": "Formulärfält måste ha tydliga etiketter eller instruktioner.",
            "technicalGuidance": "Use label elements linked to input via for/id. For complex forms, use fieldset and legend. Use aria-describedby for extra instructions.",
            "component": "@holmdigital/components/FormField",
            "codeExample": "import { FormField } from '@holmdigital/components';\n\n// Bad: No label\n<input type=\"text\" placeholder=\"Name\" />\n\n// Good: With label\n<label htmlFor=\"name\">Name:</label>\n<input type=\"text\" id=\"name\" />\n\n// Best: Use HolmDigital component\n<FormField\n  label=\"Name\"\n  type=\"text\"\n  required\n  helpText=\"Enter your full name\"\n/>",
            "wcagTechnique": [
                "G131",
                "G162",
                "H44",
                "H71"
            ]
        },
        "holmdigitalInsight": {
            "diggRisk": "high",
            "eaaImpact": "high",
            "swedishInterpretation": "Formulär är kritiska för e-tjänster. Efterlevnad kontrolleras strikt i offentlig sektor.",
            "commonMistakes": [
                "Endast placeholder utan label",
                "Label och input är inte kopplade via for/id",
                "Felmeddelanden utan aria-describedby",
                "Obligatoriska fält markeras inte tydligt"
            ],
            "diggPrecedent": "Audit decisions often criticize poor form accessibility, especially for application and contact forms.",
            "priorityRationale": "Critical for users to successfully use e-services and submit information."
        },
        "testability": {
            "automated": true,
            "requiresManualCheck": false,
            "pseudoAutomation": false,
            "complexity": "simple"
        },
        "tags": [
            "forms",
            "labels",
            "wcag2a",
            "wcag21a"
        ]
    },
    {
        "ruleId": "page-title",
        "wcagCriteria": "2.4.2",
        "wcagLevel": "A",
        "wcagTitle": "Page Titled",
        "wcagVersion": "2.0",
        "en301549Criteria": "9.2.4.2",
        "en301549Title": "Page titled",
        "en301549Chapter": 9,
        "dosLagenApplies": true,
        "dosLagenReference": "Lag 2018:1937 §7, WCAG 2.1 nivå A krävs",
        "remediation": {
            "description": "Varje webbsida måste ha en beskrivande titel.",
            "technicalGuidance": "Use the title element in head. The title should be unique for each page and describe its purpose. Format: 'Page Name - Site Name'.",
            "codeExample": "// Bad: Generic title\n<title>Page</title>\n\n// Good: Descriptive title\n<title>Contact Us - HolmDigital</title>\n\n// React/Next.js\nimport Head from 'next/head';\n\n<Head>\n  <title>Contact Us - HolmDigital</title>\n</Head>",
            "wcagTechnique": [
                "G88",
                "H25"
            ]
        },
        "holmdigitalInsight": {
            "diggRisk": "medium",
            "eaaImpact": "medium",